{
  "$schema": "https://json-schema.org/draft/2020-12/schema",
  "$id": "https://sounio.dev/schemas/SeedReceipt.v1.json",
  "title": "Sounio SeedReceipt",
  "description": "Structured proof that a lean_single seed refresh settled a fixed point. Procedure says work ran; this receipt lets someone verify it was done well months later without re-running.",
  "type": "object",
  "required": [
    "schema",
    "schema_version",
    "receipt_utc",
    "source",
    "input_seed",
    "generations",
    "fixed_point",
    "output_seed",
    "environment",
    "checks",
    "limits"
  ],
  "properties": {
    "schema": { "const": "sounio.SeedReceipt" },
    "schema_version": { "type": "integer", "minimum": 1 },
    "receipt_utc": { "type": "string" },
    "git_commit": { "type": "string" },
    "git_branch": { "type": "string" },
    "source": {
      "type": "object",
      "required": ["path", "sha256", "md5", "bytes"],
      "properties": {
        "path": { "type": "string" },
        "sha256": { "type": "string", "minLength": 64, "maxLength": 64 },
        "md5": { "type": "string", "minLength": 32, "maxLength": 32 },
        "bytes": { "type": "integer", "minimum": 1 }
      }
    },
    "input_seed": {
      "type": "object",
      "required": ["path", "sha256", "md5", "bytes"],
      "properties": {
        "path": { "type": "string" },
        "sha256": { "type": "string", "minLength": 64, "maxLength": 64 },
        "md5": { "type": "string", "minLength": 32, "maxLength": 32 },
        "bytes": { "type": "integer", "minimum": 1 },
        "role": { "type": "string" }
      }
    },
    "generations": {
      "type": "array",
      "minItems": 2,
      "items": {
        "type": "object",
        "required": ["gen", "gen_index", "md5", "sha256"],
        "properties": {
          "gen": { "type": "string" },
          "gen_index": { "type": "integer", "minimum": 0 },
          "md5": { "type": "string", "minLength": 32, "maxLength": 32 },
          "sha256": { "type": "string", "minLength": 64, "maxLength": 64 },
          "path": { "type": "string" }
        }
      }
    },
    "fixed_point": {
      "type": "object",
      "description": "FIELD not step log. A reader must confirm gk_md5 == gk_plus1_md5 by eye.",
      "required": [
        "criterion",
        "k",
        "k_plus_1",
        "gk_md5",
        "gk_plus1_md5",
        "gk_sha256",
        "gk_plus1_sha256",
        "md5_equal",
        "sha256_equal",
        "verified"
      ],
      "properties": {
        "criterion": { "type": "string" },
        "k": { "type": "integer", "minimum": 0 },
        "k_plus_1": { "type": "integer", "minimum": 1 },
        "gk_label": { "type": "string" },
        "gk_plus1_label": { "type": "string" },
        "gk_md5": { "type": "string", "minLength": 32, "maxLength": 32 },
        "gk_plus1_md5": { "type": "string", "minLength": 32, "maxLength": 32 },
        "gk_sha256": { "type": "string", "minLength": 64, "maxLength": 64 },
        "gk_plus1_sha256": { "type": "string", "minLength": 64, "maxLength": 64 },
        "md5_equal": { "type": "boolean" },
        "sha256_equal": { "type": "boolean" },
        "verified": { "type": "boolean" },
        "eyeball_md5": { "type": "string" },
        "eyeball_sha256": { "type": "string" }
      }
    },
    "output_seed": {
      "type": "object",
      "required": ["path", "sha256", "md5", "bytes"],
      "properties": {
        "path": { "type": "string" },
        "sha256": { "type": "string", "minLength": 64, "maxLength": 64 },
        "md5": { "type": "string", "minLength": 32, "maxLength": 32 },
        "bytes": { "type": "integer", "minimum": 1 }
      }
    },
    "environment": {
      "type": "object",
      "required": ["placement"],
      "properties": {
        "placement": {
          "type": "string",
          "enum": ["slurm", "local-locked", "check-only", "unknown"]
        },
        "hostname": { "type": "string" },
        "slurm_partition": { "type": "string" },
        "slurm_time": { "type": "string" },
        "slurm_job_id": { "type": "string" },
        "slurm_nodelist": { "type": "string" }
      }
    },
    "checks": {
      "type": "object",
      "properties": {
        "canonical_compiler_gate": {
          "type": "string",
          "enum": ["pass", "fail", "skip"]
        },
        "verify_lean_seed": {
          "type": "string",
          "enum": ["pass", "fail", "skip"]
        }
      }
    },
    "limits": {
      "type": "object",
      "required": ["provenance_note"],
      "properties": {
        "provenance_note": { "type": "string" }
      }
    }
  }
}
