{
  "schema": "sounio.SeedReceipt",
  "schema_version": 1,
  "receipt_utc": "2026-10-10T10:14:56Z",
  "git_commit": "c8d39f0df49f0743fcc084f5f144c1e2dc91d250",
  "git_branch": "cursor/fix-macho-dyld-shared-region-2690",
  "source": {
    "path": "/workspace/self-hosted/compiler/lean_single.sio",
    "sha256": "f64809d24d9cb9e3de2d77b0ae713b0531702220a8baf603455f839124247204",
    "md5": "b28a27460dca440b488960bb6a4d4bc2",
    "bytes": 2388173
  },
  "input_seed": {
    "path": "/workspace/out/input_seed.elf",
    "sha256": "dd042a0879cd44348a153db803730cd0a8fa2925eda60d2d799a0173fed420eb",
    "md5": "b7f3d8f4afd401fe31e69f236c7a0390",
    "bytes": 11201644,
    "role": "g0_start_of_chain"
  },
  "generations": [
    {
      "gen": "g0",
      "gen_index": 0,
      "md5": "b7f3d8f4afd401fe31e69f236c7a0390",
      "sha256": "dd042a0879cd44348a153db803730cd0a8fa2925eda60d2d799a0173fed420eb",
      "path": "/workspace/out/input_seed.elf"
    },
    {
      "gen": "g1",
      "gen_index": 1,
      "md5": "086f96ec99776ccb190d7f986f8aa22f",
      "sha256": "9510b777183d14e4d823cae3224a37875279d34ecf81b147ebfd7683bedff076",
      "path": "/workspace/out/g1.elf"
    },
    {
      "gen": "g2",
      "gen_index": 2,
      "md5": "086f96ec99776ccb190d7f986f8aa22f",
      "sha256": "9510b777183d14e4d823cae3224a37875279d34ecf81b147ebfd7683bedff076",
      "path": "/workspace/out/g2.elf"
    }
  ],
  "fixed_point": {
    "criterion": "md5(g_k) == md5(g_{k+1}) AND sha256(g_k) == sha256(g_{k+1})",
    "k": 1,
    "k_plus_1": 2,
    "gk_label": "g1",
    "gk_plus1_label": "g2",
    "gk_md5": "086f96ec99776ccb190d7f986f8aa22f",
    "gk_plus1_md5": "086f96ec99776ccb190d7f986f8aa22f",
    "gk_sha256": "9510b777183d14e4d823cae3224a37875279d34ecf81b147ebfd7683bedff076",
    "gk_plus1_sha256": "9510b777183d14e4d823cae3224a37875279d34ecf81b147ebfd7683bedff076",
    "md5_equal": true,
    "sha256_equal": true,
    "verified": true,
    "eyeball_md5": "086f96ec99776ccb190d7f986f8aa22f\n086f96ec99776ccb190d7f986f8aa22f",
    "eyeball_sha256": "9510b777183d14e4d823cae3224a37875279d34ecf81b147ebfd7683bedff076\n9510b777183d14e4d823cae3224a37875279d34ecf81b147ebfd7683bedff076"
  },
  "output_seed": {
    "path": "/workspace/bin/souc-lean-single-x86_64",
    "sha256": "9510b777183d14e4d823cae3224a37875279d34ecf81b147ebfd7683bedff076",
    "md5": "086f96ec99776ccb190d7f986f8aa22f",
    "bytes": 11204217
  },
  "environment": {
    "placement": "local-locked",
    "hostname": "cursor",
    "slurm_partition": "cpu-ops",
    "slurm_time": "00:45:00",
    "slurm_job_id": "",
    "slurm_nodelist": ""
  },
  "checks": {
    "canonical_compiler_gate": "pass",
    "verify_lean_seed": "pass"
  },
  "limits": {
    "provenance_note": "This receipt proves the installed ELF is a self-reproducing fixed point of the recorded source bytes (g_k == g_{k+1}, self-repro). It does NOT by itself prove the ELF was *derived from* that source rather than substituted from another generation that happens to self-reproduce the same source. canonical_compiler_gate.sh checks md5(committed)==md5(self-compile) \u2014 stability, not provenance. Provenance (ELF came FROM this source via this chain) is what the generation table + input_seed hashes are for; a future gate should require a SeedReceipt, not only the self-repro equality."
  }
}
