{
  "schema": "sounio.SeedReceipt",
  "schema_version": 1,
  "receipt_utc": "2026-09-18T00:11:49Z",
  "git_commit": "ec0be6de740b8898a40b2cfb0d96b511514ac85c",
  "git_branch": "feat/kl16e-ifelse-shadow-merge",
  "source": {
    "path": "/tmp/sounio-kl16e-wt/self-hosted/compiler/lean_single.sio",
    "sha256": "cc9a969c8942ccb07a301f587387a2d3dadd78830943ed93fc5aed2b750677c6",
    "md5": "e595a45f3da042dd5a10ab8f5bc5c25b",
    "bytes": 2352868
  },
  "input_seed": {
    "path": "/tmp/sounio-kl16e-wt/out/input_seed.elf",
    "sha256": "82fca8ab01cae94ab006b5fab0423f7543fd161cb6175b18905c1f3b6c221b24",
    "md5": "ba2c31ac40d16d1ec64e04c285c7915d",
    "bytes": 10972278,
    "role": "g0_start_of_chain"
  },
  "generations": [
    {
      "gen": "g0",
      "gen_index": 0,
      "md5": "ba2c31ac40d16d1ec64e04c285c7915d",
      "sha256": "82fca8ab01cae94ab006b5fab0423f7543fd161cb6175b18905c1f3b6c221b24",
      "path": "/tmp/sounio-kl16e-wt/out/input_seed.elf"
    },
    {
      "gen": "g1",
      "gen_index": 1,
      "md5": "bee4eb14a2fcbabea01cdbede0a26ab7",
      "sha256": "e1cb8f6ce854422a6df7c3157d9b263f5cb7465d92e07e42d2f707dae878fb93",
      "path": "/tmp/sounio-kl16e-wt/out/g1.elf"
    },
    {
      "gen": "g2",
      "gen_index": 2,
      "md5": "bee4eb14a2fcbabea01cdbede0a26ab7",
      "sha256": "e1cb8f6ce854422a6df7c3157d9b263f5cb7465d92e07e42d2f707dae878fb93",
      "path": "/tmp/sounio-kl16e-wt/out/g2.elf"
    }
  ],
  "fixed_point": {
    "criterion": "md5(g_k) == md5(g_{k+1}) AND sha256(g_k) == sha256(g_{k+1})",
    "k": 1,
    "k_plus_1": 2,
    "gk_label": "g1",
    "gk_plus1_label": "g2",
    "gk_md5": "bee4eb14a2fcbabea01cdbede0a26ab7",
    "gk_plus1_md5": "bee4eb14a2fcbabea01cdbede0a26ab7",
    "gk_sha256": "e1cb8f6ce854422a6df7c3157d9b263f5cb7465d92e07e42d2f707dae878fb93",
    "gk_plus1_sha256": "e1cb8f6ce854422a6df7c3157d9b263f5cb7465d92e07e42d2f707dae878fb93",
    "md5_equal": true,
    "sha256_equal": true,
    "verified": true,
    "eyeball_md5": "bee4eb14a2fcbabea01cdbede0a26ab7\nbee4eb14a2fcbabea01cdbede0a26ab7",
    "eyeball_sha256": "e1cb8f6ce854422a6df7c3157d9b263f5cb7465d92e07e42d2f707dae878fb93\ne1cb8f6ce854422a6df7c3157d9b263f5cb7465d92e07e42d2f707dae878fb93"
  },
  "output_seed": {
    "path": "/tmp/sounio-kl16e-wt/bin/souc-lean-single-x86_64",
    "sha256": "e1cb8f6ce854422a6df7c3157d9b263f5cb7465d92e07e42d2f707dae878fb93",
    "md5": "bee4eb14a2fcbabea01cdbede0a26ab7",
    "bytes": 11012742
  },
  "environment": {
    "placement": "local-locked",
    "hostname": "sounio-workspace-control-0",
    "slurm_partition": "cpu-ops",
    "slurm_time": "00:45:00",
    "slurm_job_id": "",
    "slurm_nodelist": ""
  },
  "checks": {
    "canonical_compiler_gate": "pass",
    "verify_lean_seed": "pass"
  },
  "limits": {
    "provenance_note": "This receipt proves the installed ELF is a self-reproducing fixed point of the recorded source bytes (g_k == g_{k+1}, self-repro). It does NOT by itself prove the ELF was *derived from* that source rather than substituted from another generation that happens to self-reproduce the same source. canonical_compiler_gate.sh checks md5(committed)==md5(self-compile) \u2014 stability, not provenance. Provenance (ELF came FROM this source via this chain) is what the generation table + input_seed hashes are for; a future gate should require a SeedReceipt, not only the self-repro equality."
  }
}
