{
  "schema": "sounio.SeedReceipt",
  "schema_version": 1,
  "receipt_utc": "2026-09-13T23:19:47Z",
  "git_commit": "d4ae8e795a33dedea3a983d9f150dfb155afe399",
  "git_branch": "fix/2387-lean-single-f128",
  "source": {
    "path": "/workspace/.wt/pr2426-f128/self-hosted/compiler/lean_single.sio",
    "sha256": "987ac9900733cc74a1579a15869be169f6697fdfa827986fd3978708d108e7a6",
    "md5": "e55e40db0db697d963ad3d5a4e91b402",
    "bytes": 2152651
  },
  "input_seed": {
    "path": "/workspace/.wt/pr2426-f128/out/input_seed.elf",
    "sha256": "2c123e88a47f3623961912d708dd86018163dde29188f907ea22e0b5b5c38b76",
    "md5": "b68ecab622436e696046f285055e853f",
    "bytes": 2731594,
    "role": "g0_start_of_chain"
  },
  "generations": [
    {
      "gen": "g0",
      "gen_index": 0,
      "md5": "b68ecab622436e696046f285055e853f",
      "sha256": "2c123e88a47f3623961912d708dd86018163dde29188f907ea22e0b5b5c38b76",
      "path": "/workspace/.wt/pr2426-f128/out/input_seed.elf"
    },
    {
      "gen": "g1",
      "gen_index": 1,
      "md5": "2b11e8b808f8b5fe85d9dc9cad6a4cd6",
      "sha256": "480c4137806936bd35bcb5917ce7010f89230ff7a205cf47063d1ee63cedef07",
      "path": "/workspace/.wt/pr2426-f128/out/g1.elf"
    },
    {
      "gen": "g2",
      "gen_index": 2,
      "md5": "2b11e8b808f8b5fe85d9dc9cad6a4cd6",
      "sha256": "480c4137806936bd35bcb5917ce7010f89230ff7a205cf47063d1ee63cedef07",
      "path": "/workspace/.wt/pr2426-f128/out/g2.elf"
    }
  ],
  "fixed_point": {
    "criterion": "md5(g_k) == md5(g_{k+1}) AND sha256(g_k) == sha256(g_{k+1})",
    "k": 1,
    "k_plus_1": 2,
    "gk_label": "g1",
    "gk_plus1_label": "g2",
    "gk_md5": "2b11e8b808f8b5fe85d9dc9cad6a4cd6",
    "gk_plus1_md5": "2b11e8b808f8b5fe85d9dc9cad6a4cd6",
    "gk_sha256": "480c4137806936bd35bcb5917ce7010f89230ff7a205cf47063d1ee63cedef07",
    "gk_plus1_sha256": "480c4137806936bd35bcb5917ce7010f89230ff7a205cf47063d1ee63cedef07",
    "md5_equal": true,
    "sha256_equal": true,
    "verified": true,
    "eyeball_md5": "2b11e8b808f8b5fe85d9dc9cad6a4cd6\n2b11e8b808f8b5fe85d9dc9cad6a4cd6",
    "eyeball_sha256": "480c4137806936bd35bcb5917ce7010f89230ff7a205cf47063d1ee63cedef07\n480c4137806936bd35bcb5917ce7010f89230ff7a205cf47063d1ee63cedef07"
  },
  "output_seed": {
    "path": "/workspace/.wt/pr2426-f128/bin/souc-lean-single-x86_64",
    "sha256": "480c4137806936bd35bcb5917ce7010f89230ff7a205cf47063d1ee63cedef07",
    "md5": "2b11e8b808f8b5fe85d9dc9cad6a4cd6",
    "bytes": 2732299
  },
  "environment": {
    "placement": "local-locked",
    "hostname": "sounio-workspace-control-0",
    "slurm_partition": "cpu-ops",
    "slurm_time": "00:45:00",
    "slurm_job_id": "",
    "slurm_nodelist": ""
  },
  "checks": {
    "canonical_compiler_gate": "pass",
    "verify_lean_seed": "pass"
  },
  "limits": {
    "provenance_note": "This receipt proves the installed ELF is a self-reproducing fixed point of the recorded source bytes (g_k == g_{k+1}, self-repro). It does NOT by itself prove the ELF was *derived from* that source rather than substituted from another generation that happens to self-reproduce the same source. canonical_compiler_gate.sh checks md5(committed)==md5(self-compile) \u2014 stability, not provenance. Provenance (ELF came FROM this source via this chain) is what the generation table + input_seed hashes are for; a future gate should require a SeedReceipt, not only the self-repro equality."
  }
}
