{
  "schema": "sounio.SeedReceipt",
  "schema_version": 1,
  "receipt_utc": "2026-09-03T16:30:09Z",
  "git_commit": "0c78413db093e52e0bacb6afcdd6f5c682e098d8",
  "git_branch": "feat/w4b-e072-allocation",
  "source": {
    "path": "/workspace/uhs-feat/w4b-e072-allocation/self-hosted/compiler/lean_single.sio",
    "sha256": "3998fb1d765474947d43a897882c894b5740e39d34281bedea6e2bb5f170b6fb",
    "md5": "0ed37512ac8fb1bc2f405799c85aea16",
    "bytes": 2012867
  },
  "input_seed": {
    "path": "/workspace/uhs-feat/w4b-e072-allocation/out/input_seed.elf",
    "sha256": "193631a8e5f1618b88a8de19b188eb7f4728025046efb8e4a0586567161c5675",
    "md5": "608da8eead3ffabefaa83d175858f40b",
    "bytes": 2601706,
    "role": "g0_start_of_chain"
  },
  "generations": [
    {
      "gen": "g0",
      "gen_index": 0,
      "md5": "608da8eead3ffabefaa83d175858f40b",
      "sha256": "193631a8e5f1618b88a8de19b188eb7f4728025046efb8e4a0586567161c5675",
      "path": "/workspace/uhs-feat/w4b-e072-allocation/out/input_seed.elf"
    },
    {
      "gen": "g1",
      "gen_index": 1,
      "md5": "6c4a4d2556da9d6148f4fc405be5a9a9",
      "sha256": "eaa53260d0c6dcba6017e35fb4420c420c2accc6b4fc22a2cfaab6fd8b4275d2",
      "path": "/workspace/uhs-feat/w4b-e072-allocation/out/g1.elf"
    },
    {
      "gen": "g2",
      "gen_index": 2,
      "md5": "6c4a4d2556da9d6148f4fc405be5a9a9",
      "sha256": "eaa53260d0c6dcba6017e35fb4420c420c2accc6b4fc22a2cfaab6fd8b4275d2",
      "path": "/workspace/uhs-feat/w4b-e072-allocation/out/g2.elf"
    }
  ],
  "fixed_point": {
    "criterion": "md5(g_k) == md5(g_{k+1}) AND sha256(g_k) == sha256(g_{k+1})",
    "k": 1,
    "k_plus_1": 2,
    "gk_label": "g1",
    "gk_plus1_label": "g2",
    "gk_md5": "6c4a4d2556da9d6148f4fc405be5a9a9",
    "gk_plus1_md5": "6c4a4d2556da9d6148f4fc405be5a9a9",
    "gk_sha256": "eaa53260d0c6dcba6017e35fb4420c420c2accc6b4fc22a2cfaab6fd8b4275d2",
    "gk_plus1_sha256": "eaa53260d0c6dcba6017e35fb4420c420c2accc6b4fc22a2cfaab6fd8b4275d2",
    "md5_equal": true,
    "sha256_equal": true,
    "verified": true,
    "eyeball_md5": "6c4a4d2556da9d6148f4fc405be5a9a9\n6c4a4d2556da9d6148f4fc405be5a9a9",
    "eyeball_sha256": "eaa53260d0c6dcba6017e35fb4420c420c2accc6b4fc22a2cfaab6fd8b4275d2\neaa53260d0c6dcba6017e35fb4420c420c2accc6b4fc22a2cfaab6fd8b4275d2"
  },
  "output_seed": {
    "path": "/workspace/uhs-feat/w4b-e072-allocation/bin/souc-lean-single-x86_64",
    "sha256": "eaa53260d0c6dcba6017e35fb4420c420c2accc6b4fc22a2cfaab6fd8b4275d2",
    "md5": "6c4a4d2556da9d6148f4fc405be5a9a9",
    "bytes": 2603354
  },
  "environment": {
    "placement": "local-locked",
    "hostname": "sounio-workspace-control-0",
    "slurm_partition": "cpu-ops",
    "slurm_time": "00:45:00",
    "slurm_job_id": "",
    "slurm_nodelist": ""
  },
  "checks": {
    "canonical_compiler_gate": "pass",
    "verify_lean_seed": "pass"
  },
  "limits": {
    "provenance_note": "This receipt proves the installed ELF is a self-reproducing fixed point of the recorded source bytes (g_k == g_{k+1}, self-repro). It does NOT by itself prove the ELF was *derived from* that source rather than substituted from another generation that happens to self-reproduce the same source. canonical_compiler_gate.sh checks md5(committed)==md5(self-compile) \u2014 stability, not provenance. Provenance (ELF came FROM this source via this chain) is what the generation table + input_seed hashes are for; a future gate should require a SeedReceipt, not only the self-repro equality."
  }
}
