{
  "schema": "sounio.SeedReceipt",
  "schema_version": 1,
  "receipt_utc": "2026-10-13T05:54:37Z",
  "git_commit": "a27324d252dbb1e84fd83c25142d1bfaa23ad7ae",
  "git_branch": "fix/2834-lean-local-mut",
  "source": {
    "path": "/home/claude/wt/2834/self-hosted/compiler/lean_single.sio",
    "sha256": "cc40075d221b470b009402a086444452285a1ad2b099e277bcbcd50f3c8af6a2",
    "md5": "ab7648937e7218f55f56382c2472cbe1",
    "bytes": 2399465
  },
  "input_seed": {
    "path": "/home/claude/wt/2834/out/input_seed.elf",
    "sha256": "aa4922e9dc4e5575eaac1ca0aaf28fc3b7e284ab93f6490f3763b1647e8151a5",
    "md5": "d9aa1509f69d465648fb2bb0c6fba2d3",
    "bytes": 11226863,
    "role": "g0_start_of_chain"
  },
  "generations": [
    {
      "gen": "g0",
      "gen_index": 0,
      "md5": "d9aa1509f69d465648fb2bb0c6fba2d3",
      "sha256": "aa4922e9dc4e5575eaac1ca0aaf28fc3b7e284ab93f6490f3763b1647e8151a5",
      "path": "/home/claude/wt/2834/out/input_seed.elf"
    },
    {
      "gen": "g1",
      "gen_index": 1,
      "md5": "622ecbe8aa97ee2262a5f50a2a98e47e",
      "sha256": "d1804387a4f36531a14dd9f3260990eef748b484800c9925b94511cab9d0cc6d",
      "path": "/home/claude/wt/2834/out/g1.elf"
    },
    {
      "gen": "g2",
      "gen_index": 2,
      "md5": "622ecbe8aa97ee2262a5f50a2a98e47e",
      "sha256": "d1804387a4f36531a14dd9f3260990eef748b484800c9925b94511cab9d0cc6d",
      "path": "/home/claude/wt/2834/out/g2.elf"
    }
  ],
  "fixed_point": {
    "criterion": "md5(g_k) == md5(g_{k+1}) AND sha256(g_k) == sha256(g_{k+1})",
    "k": 1,
    "k_plus_1": 2,
    "gk_label": "g1",
    "gk_plus1_label": "g2",
    "gk_md5": "622ecbe8aa97ee2262a5f50a2a98e47e",
    "gk_plus1_md5": "622ecbe8aa97ee2262a5f50a2a98e47e",
    "gk_sha256": "d1804387a4f36531a14dd9f3260990eef748b484800c9925b94511cab9d0cc6d",
    "gk_plus1_sha256": "d1804387a4f36531a14dd9f3260990eef748b484800c9925b94511cab9d0cc6d",
    "md5_equal": true,
    "sha256_equal": true,
    "verified": true,
    "eyeball_md5": "622ecbe8aa97ee2262a5f50a2a98e47e\n622ecbe8aa97ee2262a5f50a2a98e47e",
    "eyeball_sha256": "d1804387a4f36531a14dd9f3260990eef748b484800c9925b94511cab9d0cc6d\nd1804387a4f36531a14dd9f3260990eef748b484800c9925b94511cab9d0cc6d"
  },
  "output_seed": {
    "path": "/home/claude/wt/2834/bin/souc-lean-single-x86_64",
    "sha256": "d1804387a4f36531a14dd9f3260990eef748b484800c9925b94511cab9d0cc6d",
    "md5": "622ecbe8aa97ee2262a5f50a2a98e47e",
    "bytes": 11238804
  },
  "environment": {
    "placement": "local-locked",
    "hostname": "vm",
    "slurm_partition": "cpu-ops",
    "slurm_time": "00:45:00",
    "slurm_job_id": "",
    "slurm_nodelist": ""
  },
  "checks": {
    "canonical_compiler_gate": "pass",
    "verify_lean_seed": "pass"
  },
  "limits": {
    "provenance_note": "This receipt proves the installed ELF is a self-reproducing fixed point of the recorded source bytes (g_k == g_{k+1}, self-repro). It does NOT by itself prove the ELF was *derived from* that source rather than substituted from another generation that happens to self-reproduce the same source. canonical_compiler_gate.sh checks md5(committed)==md5(self-compile) \u2014 stability, not provenance. Provenance (ELF came FROM this source via this chain) is what the generation table + input_seed hashes are for; a future gate should require a SeedReceipt, not only the self-repro equality."
  }
}
