{
  "schema": "sounio.SeedReceipt",
  "schema_version": 1,
  "receipt_utc": "2026-09-03T13:23:43Z",
  "git_commit": "95916bf3654ae90e70b024b0926016e8b0381a6a",
  "git_branch": "lane/grok-cli4/r6-correlated-20260820",
  "source": {
    "path": "/tmp/claude-1-logs/pr2058-work/self-hosted/compiler/lean_single.sio",
    "sha256": "71acb1ea4a85367620a42d8aa7d9d394f1995e2918994a7ae08126e2cbfab591",
    "md5": "b02937f27b125cfa888be572b7c1d144",
    "bytes": 1984346
  },
  "input_seed": {
    "path": "/tmp/claude-1-logs/pr2058-work/out/input_seed.elf",
    "sha256": "ce84f84b64342bb86cea399a94b46fbceaf4749f414e7dceff579f54a8857369",
    "md5": "4988fab8b7248d12e690461990ffa7aa",
    "bytes": 2570242,
    "role": "g0_start_of_chain"
  },
  "generations": [
    {
      "gen": "g0",
      "gen_index": 0,
      "md5": "4988fab8b7248d12e690461990ffa7aa",
      "sha256": "ce84f84b64342bb86cea399a94b46fbceaf4749f414e7dceff579f54a8857369",
      "path": "/tmp/claude-1-logs/pr2058-work/out/input_seed.elf"
    },
    {
      "gen": "g1",
      "gen_index": 1,
      "md5": "f317ddac7c601d9b9f1939e1a5051a2a",
      "sha256": "848e876cb6a1645ef909c3e92b9d2d2b88ac4fae0ea541352bb841ba9d2279b3",
      "path": "/tmp/claude-1-logs/pr2058-work/out/g1.elf"
    },
    {
      "gen": "g2",
      "gen_index": 2,
      "md5": "5845f07f1d4a4fd5d558f37140e1a310",
      "sha256": "7f9a6a2ebb171fd4532bf66c1ce9ecca6bef97a11abfa30b1ea36f565432b3e4",
      "path": "/tmp/claude-1-logs/pr2058-work/out/g2.elf"
    },
    {
      "gen": "g3",
      "gen_index": 3,
      "md5": "5845f07f1d4a4fd5d558f37140e1a310",
      "sha256": "7f9a6a2ebb171fd4532bf66c1ce9ecca6bef97a11abfa30b1ea36f565432b3e4",
      "path": "/tmp/claude-1-logs/pr2058-work/out/g3.elf"
    }
  ],
  "fixed_point": {
    "criterion": "md5(g_k) == md5(g_{k+1}) AND sha256(g_k) == sha256(g_{k+1})",
    "k": 2,
    "k_plus_1": 3,
    "gk_label": "g2",
    "gk_plus1_label": "g3",
    "gk_md5": "5845f07f1d4a4fd5d558f37140e1a310",
    "gk_plus1_md5": "5845f07f1d4a4fd5d558f37140e1a310",
    "gk_sha256": "7f9a6a2ebb171fd4532bf66c1ce9ecca6bef97a11abfa30b1ea36f565432b3e4",
    "gk_plus1_sha256": "7f9a6a2ebb171fd4532bf66c1ce9ecca6bef97a11abfa30b1ea36f565432b3e4",
    "md5_equal": true,
    "sha256_equal": true,
    "verified": true,
    "eyeball_md5": "5845f07f1d4a4fd5d558f37140e1a310\n5845f07f1d4a4fd5d558f37140e1a310",
    "eyeball_sha256": "7f9a6a2ebb171fd4532bf66c1ce9ecca6bef97a11abfa30b1ea36f565432b3e4\n7f9a6a2ebb171fd4532bf66c1ce9ecca6bef97a11abfa30b1ea36f565432b3e4"
  },
  "output_seed": {
    "path": "/tmp/claude-1-logs/pr2058-work/bin/souc-lean-single-x86_64",
    "sha256": "7f9a6a2ebb171fd4532bf66c1ce9ecca6bef97a11abfa30b1ea36f565432b3e4",
    "md5": "5845f07f1d4a4fd5d558f37140e1a310",
    "bytes": 2575870
  },
  "environment": {
    "placement": "local-locked",
    "hostname": "sounio-workspace-control-0",
    "slurm_partition": "cpu-ops",
    "slurm_time": "00:45:00",
    "slurm_job_id": "",
    "slurm_nodelist": ""
  },
  "checks": {
    "canonical_compiler_gate": "skip",
    "verify_lean_seed": "skip"
  },
  "limits": {
    "provenance_note": "This receipt proves the installed ELF is a self-reproducing fixed point of the recorded source bytes (g_k == g_{k+1}, self-repro). It does NOT by itself prove the ELF was *derived from* that source rather than substituted from another generation that happens to self-reproduce the same source. canonical_compiler_gate.sh checks md5(committed)==md5(self-compile) \u2014 stability, not provenance. Provenance (ELF came FROM this source via this chain) is what the generation table + input_seed hashes are for; a future gate should require a SeedReceipt, not only the self-repro equality."
  }
}
