{
  "schema": "sounio.SeedReceipt",
  "schema_version": 1,
  "receipt_utc": "2026-09-22T00:25:31Z",
  "git_commit": "d4bbcf1d34b682009d5885249ef8189f63e5457a",
  "git_branch": "fix/w1-ci-round4",
  "source": {
    "path": "/tmp/w1fix7/wt/self-hosted/compiler/lean_single.sio",
    "sha256": "5c9048bdcdd89e9933e16f22bf0e7d7ce6275749ed6c6ab798449aed57cf78e0",
    "md5": "38349e2c50a6a2c5e044039956463cd9",
    "bytes": 2394622
  },
  "input_seed": {
    "path": "/tmp/w1fix7/wt/out/input_seed.elf",
    "sha256": "5c31b24703a7a9e0e4606298a2b039318f0c5da7d37b5fde5b335dcf04371274",
    "md5": "cc80ea047fb6109407f03538625d9286",
    "bytes": 11248103,
    "role": "g0_start_of_chain"
  },
  "generations": [
    {
      "gen": "g0",
      "gen_index": 0,
      "md5": "cc80ea047fb6109407f03538625d9286",
      "sha256": "5c31b24703a7a9e0e4606298a2b039318f0c5da7d37b5fde5b335dcf04371274",
      "path": "/tmp/w1fix7/wt/out/input_seed.elf"
    },
    {
      "gen": "g1",
      "gen_index": 1,
      "md5": "645a57a39c687ca775c2c97d1bbb0040",
      "sha256": "a08a12093443c84acbae105afc3c9a06400d55128fed92f32d5a9c76175f7631",
      "path": "/tmp/w1fix7/wt/out/g1.elf"
    },
    {
      "gen": "g2",
      "gen_index": 2,
      "md5": "645a57a39c687ca775c2c97d1bbb0040",
      "sha256": "a08a12093443c84acbae105afc3c9a06400d55128fed92f32d5a9c76175f7631",
      "path": "/tmp/w1fix7/wt/out/g2.elf"
    }
  ],
  "fixed_point": {
    "criterion": "md5(g_k) == md5(g_{k+1}) AND sha256(g_k) == sha256(g_{k+1})",
    "k": 1,
    "k_plus_1": 2,
    "gk_label": "g1",
    "gk_plus1_label": "g2",
    "gk_md5": "645a57a39c687ca775c2c97d1bbb0040",
    "gk_plus1_md5": "645a57a39c687ca775c2c97d1bbb0040",
    "gk_sha256": "a08a12093443c84acbae105afc3c9a06400d55128fed92f32d5a9c76175f7631",
    "gk_plus1_sha256": "a08a12093443c84acbae105afc3c9a06400d55128fed92f32d5a9c76175f7631",
    "md5_equal": true,
    "sha256_equal": true,
    "verified": true,
    "eyeball_md5": "645a57a39c687ca775c2c97d1bbb0040\n645a57a39c687ca775c2c97d1bbb0040",
    "eyeball_sha256": "a08a12093443c84acbae105afc3c9a06400d55128fed92f32d5a9c76175f7631\na08a12093443c84acbae105afc3c9a06400d55128fed92f32d5a9c76175f7631"
  },
  "output_seed": {
    "path": "/tmp/w1fix7/wt/bin/souc-lean-single-x86_64",
    "sha256": "a08a12093443c84acbae105afc3c9a06400d55128fed92f32d5a9c76175f7631",
    "md5": "645a57a39c687ca775c2c97d1bbb0040",
    "bytes": 11249365
  },
  "environment": {
    "placement": "local-locked",
    "hostname": "sounio-workspace-control-0",
    "slurm_partition": "cpu-ops",
    "slurm_time": "00:45:00",
    "slurm_job_id": "",
    "slurm_nodelist": ""
  },
  "checks": {
    "canonical_compiler_gate": "skip",
    "verify_lean_seed": "skip"
  },
  "limits": {
    "provenance_note": "This receipt proves the installed ELF is a self-reproducing fixed point of the recorded source bytes (g_k == g_{k+1}, self-repro). It does NOT by itself prove the ELF was *derived from* that source rather than substituted from another generation that happens to self-reproduce the same source. canonical_compiler_gate.sh checks md5(committed)==md5(self-compile) \u2014 stability, not provenance. Provenance (ELF came FROM this source via this chain) is what the generation table + input_seed hashes are for; a future gate should require a SeedReceipt, not only the self-repro equality."
  }
}
