{
  "schema": "sounio.SeedReceipt",
  "schema_version": 1,
  "receipt_utc": "2026-09-03T12:49:52Z",
  "git_commit": "d6e3de731a03e1cad83144b59481094eddfbe02f",
  "git_branch": "lane/grok-cli4/r6-correlated-20260820",
  "source": {
    "path": "/tmp/claude-1-logs/pr2058-work/self-hosted/compiler/lean_single.sio",
    "sha256": "4081ec13eaa527061a5ffeede8d0db46c96767060b98335b122918e56f905ff2",
    "md5": "8017f82692acb7d56173ac29fe5819d2",
    "bytes": 1983440
  },
  "input_seed": {
    "path": "/tmp/claude-1-logs/pr2058-work/out/input_seed.elf",
    "sha256": "7cd387eed5df4d415511de0c56f0411528996cbba8812e4db1ec312c9c443541",
    "md5": "0f3aa2c9dd3be4e407ce546130f7614c",
    "bytes": 2568250,
    "role": "g0_start_of_chain"
  },
  "generations": [
    {
      "gen": "g0",
      "gen_index": 0,
      "md5": "0f3aa2c9dd3be4e407ce546130f7614c",
      "sha256": "7cd387eed5df4d415511de0c56f0411528996cbba8812e4db1ec312c9c443541",
      "path": "/tmp/claude-1-logs/pr2058-work/out/input_seed.elf"
    },
    {
      "gen": "g1",
      "gen_index": 1,
      "md5": "4988fab8b7248d12e690461990ffa7aa",
      "sha256": "ce84f84b64342bb86cea399a94b46fbceaf4749f414e7dceff579f54a8857369",
      "path": "/tmp/claude-1-logs/pr2058-work/out/g1.elf"
    },
    {
      "gen": "g2",
      "gen_index": 2,
      "md5": "4988fab8b7248d12e690461990ffa7aa",
      "sha256": "ce84f84b64342bb86cea399a94b46fbceaf4749f414e7dceff579f54a8857369",
      "path": "/tmp/claude-1-logs/pr2058-work/out/g2.elf"
    }
  ],
  "fixed_point": {
    "criterion": "md5(g_k) == md5(g_{k+1}) AND sha256(g_k) == sha256(g_{k+1})",
    "k": 1,
    "k_plus_1": 2,
    "gk_label": "g1",
    "gk_plus1_label": "g2",
    "gk_md5": "4988fab8b7248d12e690461990ffa7aa",
    "gk_plus1_md5": "4988fab8b7248d12e690461990ffa7aa",
    "gk_sha256": "ce84f84b64342bb86cea399a94b46fbceaf4749f414e7dceff579f54a8857369",
    "gk_plus1_sha256": "ce84f84b64342bb86cea399a94b46fbceaf4749f414e7dceff579f54a8857369",
    "md5_equal": true,
    "sha256_equal": true,
    "verified": true,
    "eyeball_md5": "4988fab8b7248d12e690461990ffa7aa\n4988fab8b7248d12e690461990ffa7aa",
    "eyeball_sha256": "ce84f84b64342bb86cea399a94b46fbceaf4749f414e7dceff579f54a8857369\nce84f84b64342bb86cea399a94b46fbceaf4749f414e7dceff579f54a8857369"
  },
  "output_seed": {
    "path": "/tmp/claude-1-logs/pr2058-work/bin/souc-lean-single-x86_64",
    "sha256": "ce84f84b64342bb86cea399a94b46fbceaf4749f414e7dceff579f54a8857369",
    "md5": "4988fab8b7248d12e690461990ffa7aa",
    "bytes": 2570242
  },
  "environment": {
    "placement": "local-locked",
    "hostname": "sounio-workspace-control-0",
    "slurm_partition": "cpu-ops",
    "slurm_time": "00:45:00",
    "slurm_job_id": "",
    "slurm_nodelist": ""
  },
  "checks": {
    "canonical_compiler_gate": "skip",
    "verify_lean_seed": "skip"
  },
  "limits": {
    "provenance_note": "This receipt proves the installed ELF is a self-reproducing fixed point of the recorded source bytes (g_k == g_{k+1}, self-repro). It does NOT by itself prove the ELF was *derived from* that source rather than substituted from another generation that happens to self-reproduce the same source. canonical_compiler_gate.sh checks md5(committed)==md5(self-compile) \u2014 stability, not provenance. Provenance (ELF came FROM this source via this chain) is what the generation table + input_seed hashes are for; a future gate should require a SeedReceipt, not only the self-repro equality."
  }
}
