{
  "schema": "sounio.SeedReceipt",
  "schema_version": 1,
  "receipt_utc": "2026-10-13T00:26:17Z",
  "git_commit": "45d65e7c66bfb1e68e99570fef27b4e5cf4d3b93",
  "git_branch": "fix/888-shared-ref-field-store",
  "source": {
    "path": "/home/claude/wt/888/self-hosted/compiler/lean_single.sio",
    "sha256": "7c4b2d827b34fe5fa0f71cbb4e445a0724d23b1120aa5f8e29d347dc0743ed0f",
    "md5": "2b27a494d3ec852f09d911afc08600cd",
    "bytes": 2402627
  },
  "input_seed": {
    "path": "/home/claude/wt/888/out/input_seed.elf",
    "sha256": "aa4922e9dc4e5575eaac1ca0aaf28fc3b7e284ab93f6490f3763b1647e8151a5",
    "md5": "d9aa1509f69d465648fb2bb0c6fba2d3",
    "bytes": 11226863,
    "role": "g0_start_of_chain"
  },
  "generations": [
    {
      "gen": "g0",
      "gen_index": 0,
      "md5": "d9aa1509f69d465648fb2bb0c6fba2d3",
      "sha256": "aa4922e9dc4e5575eaac1ca0aaf28fc3b7e284ab93f6490f3763b1647e8151a5",
      "path": "/home/claude/wt/888/out/input_seed.elf"
    },
    {
      "gen": "g1",
      "gen_index": 1,
      "md5": "5083ed865294006b46441647f262daa6",
      "sha256": "67b3d529347437e57d1e1d929b014f162c3ba52275142711a2d7a98551e16dfd",
      "path": "/home/claude/wt/888/out/g1.elf"
    },
    {
      "gen": "g2",
      "gen_index": 2,
      "md5": "5083ed865294006b46441647f262daa6",
      "sha256": "67b3d529347437e57d1e1d929b014f162c3ba52275142711a2d7a98551e16dfd",
      "path": "/home/claude/wt/888/out/g2.elf"
    }
  ],
  "fixed_point": {
    "criterion": "md5(g_k) == md5(g_{k+1}) AND sha256(g_k) == sha256(g_{k+1})",
    "k": 1,
    "k_plus_1": 2,
    "gk_label": "g1",
    "gk_plus1_label": "g2",
    "gk_md5": "5083ed865294006b46441647f262daa6",
    "gk_plus1_md5": "5083ed865294006b46441647f262daa6",
    "gk_sha256": "67b3d529347437e57d1e1d929b014f162c3ba52275142711a2d7a98551e16dfd",
    "gk_plus1_sha256": "67b3d529347437e57d1e1d929b014f162c3ba52275142711a2d7a98551e16dfd",
    "md5_equal": true,
    "sha256_equal": true,
    "verified": true,
    "eyeball_md5": "5083ed865294006b46441647f262daa6\n5083ed865294006b46441647f262daa6",
    "eyeball_sha256": "67b3d529347437e57d1e1d929b014f162c3ba52275142711a2d7a98551e16dfd\n67b3d529347437e57d1e1d929b014f162c3ba52275142711a2d7a98551e16dfd"
  },
  "output_seed": {
    "path": "/home/claude/wt/888/bin/souc-lean-single-x86_64",
    "sha256": "67b3d529347437e57d1e1d929b014f162c3ba52275142711a2d7a98551e16dfd",
    "md5": "5083ed865294006b46441647f262daa6",
    "bytes": 11242666
  },
  "environment": {
    "placement": "local-locked",
    "hostname": "vm",
    "slurm_partition": "cpu-ops",
    "slurm_time": "00:45:00",
    "slurm_job_id": "",
    "slurm_nodelist": ""
  },
  "checks": {
    "canonical_compiler_gate": "skip",
    "verify_lean_seed": "skip"
  },
  "limits": {
    "provenance_note": "This receipt proves the installed ELF is a self-reproducing fixed point of the recorded source bytes (g_k == g_{k+1}, self-repro). It does NOT by itself prove the ELF was *derived from* that source rather than substituted from another generation that happens to self-reproduce the same source. canonical_compiler_gate.sh checks md5(committed)==md5(self-compile) \u2014 stability, not provenance. Provenance (ELF came FROM this source via this chain) is what the generation table + input_seed hashes are for; a future gate should require a SeedReceipt, not only the self-repro equality."
  }
}
