{
  "schema": "sounio.SeedReceipt",
  "schema_version": 1,
  "receipt_utc": "2026-09-03T13:56:14Z",
  "git_commit": "31cc693669fcbbf40df6fe117516d6ce5cf64b74",
  "git_branch": "feat/w4b-e072-allocation",
  "source": {
    "path": "/workspace/uhs-feat/w4b-e072-allocation/self-hosted/compiler/lean_single.sio",
    "sha256": "df43e6b30c82ea47f8fe50e3ff34bba03d3db4ec5986fc6882db4cb1299fa55c",
    "md5": "ebac6b62a772557a369743858a0a5224",
    "bytes": 2005995
  },
  "input_seed": {
    "path": "/workspace/uhs-feat/w4b-e072-allocation/out/input_seed.elf",
    "sha256": "7cd387eed5df4d415511de0c56f0411528996cbba8812e4db1ec312c9c443541",
    "md5": "0f3aa2c9dd3be4e407ce546130f7614c",
    "bytes": 2568250,
    "role": "g0_start_of_chain"
  },
  "generations": [
    {
      "gen": "g0",
      "gen_index": 0,
      "md5": "0f3aa2c9dd3be4e407ce546130f7614c",
      "sha256": "7cd387eed5df4d415511de0c56f0411528996cbba8812e4db1ec312c9c443541",
      "path": "/workspace/uhs-feat/w4b-e072-allocation/out/input_seed.elf"
    },
    {
      "gen": "g1",
      "gen_index": 1,
      "md5": "cc33e624e7ae0c2bd913e3ba2b3d3e55",
      "sha256": "a50676a9420e6b14415702d25e6b8d0884515affac9f250a9420e15983f3bcba",
      "path": "/workspace/uhs-feat/w4b-e072-allocation/out/g1.elf"
    },
    {
      "gen": "g2",
      "gen_index": 2,
      "md5": "c20a449091aed69ac9057dff54277ac1",
      "sha256": "e9605efcded0927891dcbccf4a45115d5ea8aa320f43238eb3b295dc000a3982",
      "path": "/workspace/uhs-feat/w4b-e072-allocation/out/g2.elf"
    },
    {
      "gen": "g3",
      "gen_index": 3,
      "md5": "c20a449091aed69ac9057dff54277ac1",
      "sha256": "e9605efcded0927891dcbccf4a45115d5ea8aa320f43238eb3b295dc000a3982",
      "path": "/workspace/uhs-feat/w4b-e072-allocation/out/g3.elf"
    }
  ],
  "fixed_point": {
    "criterion": "md5(g_k) == md5(g_{k+1}) AND sha256(g_k) == sha256(g_{k+1})",
    "k": 2,
    "k_plus_1": 3,
    "gk_label": "g2",
    "gk_plus1_label": "g3",
    "gk_md5": "c20a449091aed69ac9057dff54277ac1",
    "gk_plus1_md5": "c20a449091aed69ac9057dff54277ac1",
    "gk_sha256": "e9605efcded0927891dcbccf4a45115d5ea8aa320f43238eb3b295dc000a3982",
    "gk_plus1_sha256": "e9605efcded0927891dcbccf4a45115d5ea8aa320f43238eb3b295dc000a3982",
    "md5_equal": true,
    "sha256_equal": true,
    "verified": true,
    "eyeball_md5": "c20a449091aed69ac9057dff54277ac1\nc20a449091aed69ac9057dff54277ac1",
    "eyeball_sha256": "e9605efcded0927891dcbccf4a45115d5ea8aa320f43238eb3b295dc000a3982\ne9605efcded0927891dcbccf4a45115d5ea8aa320f43238eb3b295dc000a3982"
  },
  "output_seed": {
    "path": "/workspace/uhs-feat/w4b-e072-allocation/bin/souc-lean-single-x86_64",
    "sha256": "e9605efcded0927891dcbccf4a45115d5ea8aa320f43238eb3b295dc000a3982",
    "md5": "c20a449091aed69ac9057dff54277ac1",
    "bytes": 2594065
  },
  "environment": {
    "placement": "local-locked",
    "hostname": "sounio-workspace-control-0",
    "slurm_partition": "cpu-ops",
    "slurm_time": "00:45:00",
    "slurm_job_id": "",
    "slurm_nodelist": ""
  },
  "checks": {
    "canonical_compiler_gate": "pass",
    "verify_lean_seed": "pass"
  },
  "limits": {
    "provenance_note": "This receipt proves the installed ELF is a self-reproducing fixed point of the recorded source bytes (g_k == g_{k+1}, self-repro). It does NOT by itself prove the ELF was *derived from* that source rather than substituted from another generation that happens to self-reproduce the same source. canonical_compiler_gate.sh checks md5(committed)==md5(self-compile) \u2014 stability, not provenance. Provenance (ELF came FROM this source via this chain) is what the generation table + input_seed hashes are for; a future gate should require a SeedReceipt, not only the self-repro equality."
  }
}
