{
  "schema": "sounio.SeedReceipt",
  "schema_version": 1,
  "receipt_utc": "2026-09-01T14:43:48Z",
  "git_commit": "5205258eadf825db637f9e7f94c58f6e9e5644f5",
  "git_branch": "fable/module-let-consts-followup-20260901",
  "source": {
    "path": "/workspace/.wt/agf-2361/self-hosted/compiler/lean_single.sio",
    "sha256": "3da4fed34052bc9e9a9e9667748811087ffc2a6796f13dd2c3230dfd61fbe5bc",
    "md5": "5d8c646557153ddd4f0cac5a4e1017c9",
    "bytes": 1979724
  },
  "input_seed": {
    "path": "/workspace/.wt/agf-2361/out/input_seed.elf",
    "sha256": "e594a9ab7985f5c906bf472c1f588b454d4b1529641beb3885edf9df86916712",
    "md5": "458d82bc22e44caaca1161231f56d82d",
    "bytes": 2561610,
    "role": "g0_start_of_chain"
  },
  "generations": [
    {
      "gen": "g0",
      "gen_index": 0,
      "md5": "458d82bc22e44caaca1161231f56d82d",
      "sha256": "e594a9ab7985f5c906bf472c1f588b454d4b1529641beb3885edf9df86916712",
      "path": "/workspace/.wt/agf-2361/out/input_seed.elf"
    },
    {
      "gen": "g1",
      "gen_index": 1,
      "md5": "0f3aa2c9dd3be4e407ce546130f7614c",
      "sha256": "7cd387eed5df4d415511de0c56f0411528996cbba8812e4db1ec312c9c443541",
      "path": "/workspace/.wt/agf-2361/out/g1.elf"
    },
    {
      "gen": "g2",
      "gen_index": 2,
      "md5": "0f3aa2c9dd3be4e407ce546130f7614c",
      "sha256": "7cd387eed5df4d415511de0c56f0411528996cbba8812e4db1ec312c9c443541",
      "path": "/workspace/.wt/agf-2361/out/g2.elf"
    }
  ],
  "fixed_point": {
    "criterion": "md5(g_k) == md5(g_{k+1}) AND sha256(g_k) == sha256(g_{k+1})",
    "k": 1,
    "k_plus_1": 2,
    "gk_label": "g1",
    "gk_plus1_label": "g2",
    "gk_md5": "0f3aa2c9dd3be4e407ce546130f7614c",
    "gk_plus1_md5": "0f3aa2c9dd3be4e407ce546130f7614c",
    "gk_sha256": "7cd387eed5df4d415511de0c56f0411528996cbba8812e4db1ec312c9c443541",
    "gk_plus1_sha256": "7cd387eed5df4d415511de0c56f0411528996cbba8812e4db1ec312c9c443541",
    "md5_equal": true,
    "sha256_equal": true,
    "verified": true,
    "eyeball_md5": "0f3aa2c9dd3be4e407ce546130f7614c\n0f3aa2c9dd3be4e407ce546130f7614c",
    "eyeball_sha256": "7cd387eed5df4d415511de0c56f0411528996cbba8812e4db1ec312c9c443541\n7cd387eed5df4d415511de0c56f0411528996cbba8812e4db1ec312c9c443541"
  },
  "output_seed": {
    "path": "/workspace/.wt/agf-2361/bin/souc-lean-single-x86_64",
    "sha256": "7cd387eed5df4d415511de0c56f0411528996cbba8812e4db1ec312c9c443541",
    "md5": "0f3aa2c9dd3be4e407ce546130f7614c",
    "bytes": 2568250
  },
  "environment": {
    "placement": "local-locked",
    "hostname": "sounio-workspace-control-0",
    "slurm_partition": "cpu-ops",
    "slurm_time": "00:45:00",
    "slurm_job_id": "",
    "slurm_nodelist": ""
  },
  "checks": {
    "canonical_compiler_gate": "pass",
    "verify_lean_seed": "pass"
  },
  "limits": {
    "provenance_note": "This receipt proves the installed ELF is a self-reproducing fixed point of the recorded source bytes (g_k == g_{k+1}, self-repro). It does NOT by itself prove the ELF was *derived from* that source rather than substituted from another generation that happens to self-reproduce the same source. canonical_compiler_gate.sh checks md5(committed)==md5(self-compile) \u2014 stability, not provenance. Provenance (ELF came FROM this source via this chain) is what the generation table + input_seed hashes are for; a future gate should require a SeedReceipt, not only the self-repro equality."
  }
}
