{
  "schema": "sounio.SeedReceipt",
  "schema_version": 1,
  "receipt_utc": "2026-09-03T13:53:05Z",
  "git_commit": "e8f9b4f32749935703f87c18e7a157947b8fd936",
  "git_branch": "feat/w6-neg-f64-global",
  "source": {
    "path": "/workspace/uhs-feat/w6-neg-f64-global/self-hosted/compiler/lean_single.sio",
    "sha256": "f3c1aac3c06ab27f21fa76797542c7db7d1cff6f553996fbcf72593f690774d8",
    "md5": "54f0f29882dd0c991df9351078787999",
    "bytes": 1981974
  },
  "input_seed": {
    "path": "/workspace/uhs-feat/w6-neg-f64-global/out/input_seed.elf",
    "sha256": "7cd387eed5df4d415511de0c56f0411528996cbba8812e4db1ec312c9c443541",
    "md5": "0f3aa2c9dd3be4e407ce546130f7614c",
    "bytes": 2568250,
    "role": "g0_start_of_chain"
  },
  "generations": [
    {
      "gen": "g0",
      "gen_index": 0,
      "md5": "0f3aa2c9dd3be4e407ce546130f7614c",
      "sha256": "7cd387eed5df4d415511de0c56f0411528996cbba8812e4db1ec312c9c443541",
      "path": "/workspace/uhs-feat/w6-neg-f64-global/out/input_seed.elf"
    },
    {
      "gen": "g1",
      "gen_index": 1,
      "md5": "fe4d49152e4dbb1e5d505db88cb4f175",
      "sha256": "adb5260a5a8fb5ffd4fac118c362bfaa78d391f88e3ca22a924fc5790338eff1",
      "path": "/workspace/uhs-feat/w6-neg-f64-global/out/g1.elf"
    },
    {
      "gen": "g2",
      "gen_index": 2,
      "md5": "fe4d49152e4dbb1e5d505db88cb4f175",
      "sha256": "adb5260a5a8fb5ffd4fac118c362bfaa78d391f88e3ca22a924fc5790338eff1",
      "path": "/workspace/uhs-feat/w6-neg-f64-global/out/g2.elf"
    }
  ],
  "fixed_point": {
    "criterion": "md5(g_k) == md5(g_{k+1}) AND sha256(g_k) == sha256(g_{k+1})",
    "k": 1,
    "k_plus_1": 2,
    "gk_label": "g1",
    "gk_plus1_label": "g2",
    "gk_md5": "fe4d49152e4dbb1e5d505db88cb4f175",
    "gk_plus1_md5": "fe4d49152e4dbb1e5d505db88cb4f175",
    "gk_sha256": "adb5260a5a8fb5ffd4fac118c362bfaa78d391f88e3ca22a924fc5790338eff1",
    "gk_plus1_sha256": "adb5260a5a8fb5ffd4fac118c362bfaa78d391f88e3ca22a924fc5790338eff1",
    "md5_equal": true,
    "sha256_equal": true,
    "verified": true,
    "eyeball_md5": "fe4d49152e4dbb1e5d505db88cb4f175\nfe4d49152e4dbb1e5d505db88cb4f175",
    "eyeball_sha256": "adb5260a5a8fb5ffd4fac118c362bfaa78d391f88e3ca22a924fc5790338eff1\nadb5260a5a8fb5ffd4fac118c362bfaa78d391f88e3ca22a924fc5790338eff1"
  },
  "output_seed": {
    "path": "/workspace/uhs-feat/w6-neg-f64-global/bin/souc-lean-single-x86_64",
    "sha256": "adb5260a5a8fb5ffd4fac118c362bfaa78d391f88e3ca22a924fc5790338eff1",
    "md5": "fe4d49152e4dbb1e5d505db88cb4f175",
    "bytes": 2569895
  },
  "environment": {
    "placement": "local-locked",
    "hostname": "sounio-workspace-control-0",
    "slurm_partition": "cpu-ops",
    "slurm_time": "00:45:00",
    "slurm_job_id": "",
    "slurm_nodelist": ""
  },
  "checks": {
    "canonical_compiler_gate": "pass",
    "verify_lean_seed": "pass"
  },
  "limits": {
    "provenance_note": "This receipt proves the installed ELF is a self-reproducing fixed point of the recorded source bytes (g_k == g_{k+1}, self-repro). It does NOT by itself prove the ELF was *derived from* that source rather than substituted from another generation that happens to self-reproduce the same source. canonical_compiler_gate.sh checks md5(committed)==md5(self-compile) \u2014 stability, not provenance. Provenance (ELF came FROM this source via this chain) is what the generation table + input_seed hashes are for; a future gate should require a SeedReceipt, not only the self-repro equality."
  }
}
