{
  "schema": "sounio.SeedReceipt",
  "schema_version": 1,
  "receipt_utc": "2026-09-03T14:43:27Z",
  "git_commit": "27e3541bb46853c6a7c5a538b6629c9a64f0c48f",
  "git_branch": "feat/w6-neg-f64-global",
  "source": {
    "path": "/workspace/uhs-feat/w6-neg-f64-global/self-hosted/compiler/lean_single.sio",
    "sha256": "f69a03e2b7f93868efe54ecfdaa90eb5617967f294c0b227de70abbfc4072a14",
    "md5": "abc5aee3d7847d971b9221aa09bcf7f0",
    "bytes": 1986596
  },
  "input_seed": {
    "path": "/workspace/uhs-feat/w6-neg-f64-global/out/input_seed.elf",
    "sha256": "adb5260a5a8fb5ffd4fac118c362bfaa78d391f88e3ca22a924fc5790338eff1",
    "md5": "fe4d49152e4dbb1e5d505db88cb4f175",
    "bytes": 2569895,
    "role": "g0_start_of_chain"
  },
  "generations": [
    {
      "gen": "g0",
      "gen_index": 0,
      "md5": "fe4d49152e4dbb1e5d505db88cb4f175",
      "sha256": "adb5260a5a8fb5ffd4fac118c362bfaa78d391f88e3ca22a924fc5790338eff1",
      "path": "/workspace/uhs-feat/w6-neg-f64-global/out/input_seed.elf"
    },
    {
      "gen": "g1",
      "gen_index": 1,
      "md5": "85ab8da3fc145cfae1e6d6c62e1ebc7b",
      "sha256": "3bdfd33b47a931c25e4047b04ee904722921700852345dd0d8d10bee09a388f3",
      "path": "/workspace/uhs-feat/w6-neg-f64-global/out/g1.elf"
    },
    {
      "gen": "g2",
      "gen_index": 2,
      "md5": "f578f4f718a9bd788cd23d944ea6b620",
      "sha256": "32ff711ff0608adb0d3840b68819185dee5b7c31a9e0e32224c7339b79adbb9a",
      "path": "/workspace/uhs-feat/w6-neg-f64-global/out/g2.elf"
    },
    {
      "gen": "g3",
      "gen_index": 3,
      "md5": "f578f4f718a9bd788cd23d944ea6b620",
      "sha256": "32ff711ff0608adb0d3840b68819185dee5b7c31a9e0e32224c7339b79adbb9a",
      "path": "/workspace/uhs-feat/w6-neg-f64-global/out/g3.elf"
    }
  ],
  "fixed_point": {
    "criterion": "md5(g_k) == md5(g_{k+1}) AND sha256(g_k) == sha256(g_{k+1})",
    "k": 2,
    "k_plus_1": 3,
    "gk_label": "g2",
    "gk_plus1_label": "g3",
    "gk_md5": "f578f4f718a9bd788cd23d944ea6b620",
    "gk_plus1_md5": "f578f4f718a9bd788cd23d944ea6b620",
    "gk_sha256": "32ff711ff0608adb0d3840b68819185dee5b7c31a9e0e32224c7339b79adbb9a",
    "gk_plus1_sha256": "32ff711ff0608adb0d3840b68819185dee5b7c31a9e0e32224c7339b79adbb9a",
    "md5_equal": true,
    "sha256_equal": true,
    "verified": true,
    "eyeball_md5": "f578f4f718a9bd788cd23d944ea6b620\nf578f4f718a9bd788cd23d944ea6b620",
    "eyeball_sha256": "32ff711ff0608adb0d3840b68819185dee5b7c31a9e0e32224c7339b79adbb9a\n32ff711ff0608adb0d3840b68819185dee5b7c31a9e0e32224c7339b79adbb9a"
  },
  "output_seed": {
    "path": "/workspace/uhs-feat/w6-neg-f64-global/bin/souc-lean-single-x86_64",
    "sha256": "32ff711ff0608adb0d3840b68819185dee5b7c31a9e0e32224c7339b79adbb9a",
    "md5": "f578f4f718a9bd788cd23d944ea6b620",
    "bytes": 2577518
  },
  "environment": {
    "placement": "local-locked",
    "hostname": "sounio-workspace-control-0",
    "slurm_partition": "cpu-ops",
    "slurm_time": "00:45:00",
    "slurm_job_id": "",
    "slurm_nodelist": ""
  },
  "checks": {
    "canonical_compiler_gate": "skip",
    "verify_lean_seed": "skip"
  },
  "limits": {
    "provenance_note": "This receipt proves the installed ELF is a self-reproducing fixed point of the recorded source bytes (g_k == g_{k+1}, self-repro). It does NOT by itself prove the ELF was *derived from* that source rather than substituted from another generation that happens to self-reproduce the same source. canonical_compiler_gate.sh checks md5(committed)==md5(self-compile) \u2014 stability, not provenance. Provenance (ELF came FROM this source via this chain) is what the generation table + input_seed hashes are for; a future gate should require a SeedReceipt, not only the self-repro equality."
  }
}
