{
  "schema": "sounio.SeedReceipt",
  "schema_version": 1,
  "receipt_utc": "2026-10-13T00:43:13Z",
  "git_commit": "1e2c9ece15629a82f6b62424e5ed2bad11e6899a",
  "git_branch": "fix/1655-lean-struct-array-storage",
  "source": {
    "path": "/home/claude/wt/1655/self-hosted/compiler/lean_single.sio",
    "sha256": "8ce12549e28669c381a86efa3b26c7f7ce728d94c0f11ebd9b0282a7d12c0b57",
    "md5": "21511891bad3219e0c6c635de6f6e194",
    "bytes": 2403855
  },
  "input_seed": {
    "path": "/home/claude/wt/1655/out/input_seed.elf",
    "sha256": "aa4922e9dc4e5575eaac1ca0aaf28fc3b7e284ab93f6490f3763b1647e8151a5",
    "md5": "d9aa1509f69d465648fb2bb0c6fba2d3",
    "bytes": 11226863,
    "role": "g0_start_of_chain"
  },
  "generations": [
    {
      "gen": "g0",
      "gen_index": 0,
      "md5": "d9aa1509f69d465648fb2bb0c6fba2d3",
      "sha256": "aa4922e9dc4e5575eaac1ca0aaf28fc3b7e284ab93f6490f3763b1647e8151a5",
      "path": "/home/claude/wt/1655/out/input_seed.elf"
    },
    {
      "gen": "g1",
      "gen_index": 1,
      "md5": "77fb44e0d8edf73a8c789406e5e09ed3",
      "sha256": "9ff4a38f92cc0e2e9c9be1878f396c088a95c6c6931739f2ff6a0523accd5c02",
      "path": "/home/claude/wt/1655/out/g1.elf"
    },
    {
      "gen": "g2",
      "gen_index": 2,
      "md5": "77fb44e0d8edf73a8c789406e5e09ed3",
      "sha256": "9ff4a38f92cc0e2e9c9be1878f396c088a95c6c6931739f2ff6a0523accd5c02",
      "path": "/home/claude/wt/1655/out/g2.elf"
    }
  ],
  "fixed_point": {
    "criterion": "md5(g_k) == md5(g_{k+1}) AND sha256(g_k) == sha256(g_{k+1})",
    "k": 1,
    "k_plus_1": 2,
    "gk_label": "g1",
    "gk_plus1_label": "g2",
    "gk_md5": "77fb44e0d8edf73a8c789406e5e09ed3",
    "gk_plus1_md5": "77fb44e0d8edf73a8c789406e5e09ed3",
    "gk_sha256": "9ff4a38f92cc0e2e9c9be1878f396c088a95c6c6931739f2ff6a0523accd5c02",
    "gk_plus1_sha256": "9ff4a38f92cc0e2e9c9be1878f396c088a95c6c6931739f2ff6a0523accd5c02",
    "md5_equal": true,
    "sha256_equal": true,
    "verified": true,
    "eyeball_md5": "77fb44e0d8edf73a8c789406e5e09ed3\n77fb44e0d8edf73a8c789406e5e09ed3",
    "eyeball_sha256": "9ff4a38f92cc0e2e9c9be1878f396c088a95c6c6931739f2ff6a0523accd5c02\n9ff4a38f92cc0e2e9c9be1878f396c088a95c6c6931739f2ff6a0523accd5c02"
  },
  "output_seed": {
    "path": "/home/claude/wt/1655/bin/souc-lean-single-x86_64",
    "sha256": "9ff4a38f92cc0e2e9c9be1878f396c088a95c6c6931739f2ff6a0523accd5c02",
    "md5": "77fb44e0d8edf73a8c789406e5e09ed3",
    "bytes": 11255392
  },
  "environment": {
    "placement": "local-locked",
    "hostname": "vm",
    "slurm_partition": "cpu-ops",
    "slurm_time": "00:45:00",
    "slurm_job_id": "",
    "slurm_nodelist": ""
  },
  "checks": {
    "canonical_compiler_gate": "skip",
    "verify_lean_seed": "skip"
  },
  "limits": {
    "provenance_note": "This receipt proves the installed ELF is a self-reproducing fixed point of the recorded source bytes (g_k == g_{k+1}, self-repro). It does NOT by itself prove the ELF was *derived from* that source rather than substituted from another generation that happens to self-reproduce the same source. canonical_compiler_gate.sh checks md5(committed)==md5(self-compile) \u2014 stability, not provenance. Provenance (ELF came FROM this source via this chain) is what the generation table + input_seed hashes are for; a future gate should require a SeedReceipt, not only the self-repro equality."
  }
}
