{
  "schema": "sounio.SeedReceipt",
  "schema_version": 1,
  "receipt_utc": "2026-10-13T01:56:05Z",
  "git_commit": "5918a5a298008881071b662145db13fc8b6fb184",
  "git_branch": "fix/2422-2429-a64-diagnostics",
  "source": {
    "path": "/home/claude/wt/na64/self-hosted/compiler/lean_single.sio",
    "sha256": "d7511ea7603c61d167c4ec99d1915c45d27a469e43cdad8228247f1fa542cc94",
    "md5": "3c73e71dce8efdb367d1305f9811cc51",
    "bytes": 2397659
  },
  "input_seed": {
    "path": "/home/claude/wt/na64/out/input_seed.elf",
    "sha256": "aa4922e9dc4e5575eaac1ca0aaf28fc3b7e284ab93f6490f3763b1647e8151a5",
    "md5": "d9aa1509f69d465648fb2bb0c6fba2d3",
    "bytes": 11226863,
    "role": "g0_start_of_chain"
  },
  "generations": [
    {
      "gen": "g0",
      "gen_index": 0,
      "md5": "d9aa1509f69d465648fb2bb0c6fba2d3",
      "sha256": "aa4922e9dc4e5575eaac1ca0aaf28fc3b7e284ab93f6490f3763b1647e8151a5",
      "path": "/home/claude/wt/na64/out/input_seed.elf"
    },
    {
      "gen": "g1",
      "gen_index": 1,
      "md5": "2195c9f1120586bb04528784a644eaa1",
      "sha256": "3801b589322bfae295fb0fd50c5c359cb38ca8978761d1ec44e29f0602cec0f6",
      "path": "/home/claude/wt/na64/out/g1.elf"
    },
    {
      "gen": "g2",
      "gen_index": 2,
      "md5": "2195c9f1120586bb04528784a644eaa1",
      "sha256": "3801b589322bfae295fb0fd50c5c359cb38ca8978761d1ec44e29f0602cec0f6",
      "path": "/home/claude/wt/na64/out/g2.elf"
    }
  ],
  "fixed_point": {
    "criterion": "md5(g_k) == md5(g_{k+1}) AND sha256(g_k) == sha256(g_{k+1})",
    "k": 1,
    "k_plus_1": 2,
    "gk_label": "g1",
    "gk_plus1_label": "g2",
    "gk_md5": "2195c9f1120586bb04528784a644eaa1",
    "gk_plus1_md5": "2195c9f1120586bb04528784a644eaa1",
    "gk_sha256": "3801b589322bfae295fb0fd50c5c359cb38ca8978761d1ec44e29f0602cec0f6",
    "gk_plus1_sha256": "3801b589322bfae295fb0fd50c5c359cb38ca8978761d1ec44e29f0602cec0f6",
    "md5_equal": true,
    "sha256_equal": true,
    "verified": true,
    "eyeball_md5": "2195c9f1120586bb04528784a644eaa1\n2195c9f1120586bb04528784a644eaa1",
    "eyeball_sha256": "3801b589322bfae295fb0fd50c5c359cb38ca8978761d1ec44e29f0602cec0f6\n3801b589322bfae295fb0fd50c5c359cb38ca8978761d1ec44e29f0602cec0f6"
  },
  "output_seed": {
    "path": "/home/claude/wt/na64/bin/souc-lean-single-x86_64",
    "sha256": "3801b589322bfae295fb0fd50c5c359cb38ca8978761d1ec44e29f0602cec0f6",
    "md5": "2195c9f1120586bb04528784a644eaa1",
    "bytes": 11227516
  },
  "environment": {
    "placement": "local-locked",
    "hostname": "vm",
    "slurm_partition": "cpu-ops",
    "slurm_time": "00:45:00",
    "slurm_job_id": "",
    "slurm_nodelist": ""
  },
  "checks": {
    "canonical_compiler_gate": "pass",
    "verify_lean_seed": "pass"
  },
  "limits": {
    "provenance_note": "This receipt proves the installed ELF is a self-reproducing fixed point of the recorded source bytes (g_k == g_{k+1}, self-repro). It does NOT by itself prove the ELF was *derived from* that source rather than substituted from another generation that happens to self-reproduce the same source. canonical_compiler_gate.sh checks md5(committed)==md5(self-compile) \u2014 stability, not provenance. Provenance (ELF came FROM this source via this chain) is what the generation table + input_seed hashes are for; a future gate should require a SeedReceipt, not only the self-repro equality."
  }
}
