{
  "schema": "sounio.SeedReceipt",
  "schema_version": 1,
  "receipt_utc": "2026-10-13T01:00:33Z",
  "git_commit": "7824fc7ab7aa1e229d12bdf0b4834dcc57d06d7a",
  "git_branch": "fix/2753-knowledge-where-refused",
  "source": {
    "path": "/home/claude/wt/m-b/self-hosted/compiler/lean_single.sio",
    "sha256": "62077656ef6cb3c2a71cfab061e5167a4a608d700af32f12bb611d18d2ffc634",
    "md5": "b7dafbaf163ec533ca8f40a089c041c7",
    "bytes": 2397023
  },
  "input_seed": {
    "path": "/home/claude/wt/m-b/out/input_seed.elf",
    "sha256": "aa4922e9dc4e5575eaac1ca0aaf28fc3b7e284ab93f6490f3763b1647e8151a5",
    "md5": "d9aa1509f69d465648fb2bb0c6fba2d3",
    "bytes": 11226863,
    "role": "g0_start_of_chain"
  },
  "generations": [
    {
      "gen": "g0",
      "gen_index": 0,
      "md5": "d9aa1509f69d465648fb2bb0c6fba2d3",
      "sha256": "aa4922e9dc4e5575eaac1ca0aaf28fc3b7e284ab93f6490f3763b1647e8151a5",
      "path": "/home/claude/wt/m-b/out/input_seed.elf"
    },
    {
      "gen": "g1",
      "gen_index": 1,
      "md5": "4fe61046ead4a0a030c71bdbdacff3ca",
      "sha256": "a515f279417bfbaa78082de5d6a3b915eec1866d7a485402b53b076b84a7c978",
      "path": "/home/claude/wt/m-b/out/g1.elf"
    },
    {
      "gen": "g2",
      "gen_index": 2,
      "md5": "4fe61046ead4a0a030c71bdbdacff3ca",
      "sha256": "a515f279417bfbaa78082de5d6a3b915eec1866d7a485402b53b076b84a7c978",
      "path": "/home/claude/wt/m-b/out/g2.elf"
    }
  ],
  "fixed_point": {
    "criterion": "md5(g_k) == md5(g_{k+1}) AND sha256(g_k) == sha256(g_{k+1})",
    "k": 1,
    "k_plus_1": 2,
    "gk_label": "g1",
    "gk_plus1_label": "g2",
    "gk_md5": "4fe61046ead4a0a030c71bdbdacff3ca",
    "gk_plus1_md5": "4fe61046ead4a0a030c71bdbdacff3ca",
    "gk_sha256": "a515f279417bfbaa78082de5d6a3b915eec1866d7a485402b53b076b84a7c978",
    "gk_plus1_sha256": "a515f279417bfbaa78082de5d6a3b915eec1866d7a485402b53b076b84a7c978",
    "md5_equal": true,
    "sha256_equal": true,
    "verified": true,
    "eyeball_md5": "4fe61046ead4a0a030c71bdbdacff3ca\n4fe61046ead4a0a030c71bdbdacff3ca",
    "eyeball_sha256": "a515f279417bfbaa78082de5d6a3b915eec1866d7a485402b53b076b84a7c978\na515f279417bfbaa78082de5d6a3b915eec1866d7a485402b53b076b84a7c978"
  },
  "output_seed": {
    "path": "/home/claude/wt/m-b/bin/souc-lean-single-x86_64",
    "sha256": "a515f279417bfbaa78082de5d6a3b915eec1866d7a485402b53b076b84a7c978",
    "md5": "4fe61046ead4a0a030c71bdbdacff3ca",
    "bytes": 11229350
  },
  "environment": {
    "placement": "local-locked",
    "hostname": "vm",
    "slurm_partition": "cpu-ops",
    "slurm_time": "00:45:00",
    "slurm_job_id": "",
    "slurm_nodelist": ""
  },
  "checks": {
    "canonical_compiler_gate": "pass",
    "verify_lean_seed": "pass"
  },
  "limits": {
    "provenance_note": "This receipt proves the installed ELF is a self-reproducing fixed point of the recorded source bytes (g_k == g_{k+1}, self-repro). It does NOT by itself prove the ELF was *derived from* that source rather than substituted from another generation that happens to self-reproduce the same source. canonical_compiler_gate.sh checks md5(committed)==md5(self-compile) \u2014 stability, not provenance. Provenance (ELF came FROM this source via this chain) is what the generation table + input_seed hashes are for; a future gate should require a SeedReceipt, not only the self-repro equality."
  }
}
