{
  "schema": "sounio.SeedReceipt",
  "schema_version": 1,
  "receipt_utc": "2026-10-09T10:23:06Z",
  "git_commit": "4cc871475279f00be376dddad24ee61ae51852ab",
  "git_branch": "cursor/fix-a64-cond-branch-range-2690",
  "source": {
    "path": "/workspace/self-hosted/compiler/lean_single.sio",
    "sha256": "2b6c8f799ebda236729f4e9c1f6eb141b7ea8f7194086d88f15175b8a1c64b84",
    "md5": "5c16d957bd68d01bd4f8f5ae9f0609b3",
    "bytes": 2385925
  },
  "input_seed": {
    "path": "/workspace/out/input_seed.elf",
    "sha256": "e91471fbe16b069033cdc1397a7f5b44aeda0796db6de7602829f893418dd934",
    "md5": "18f6fcff4bea004af04a211c18017638",
    "bytes": 11200097,
    "role": "g0_start_of_chain"
  },
  "generations": [
    {
      "gen": "g0",
      "gen_index": 0,
      "md5": "18f6fcff4bea004af04a211c18017638",
      "sha256": "e91471fbe16b069033cdc1397a7f5b44aeda0796db6de7602829f893418dd934",
      "path": "/workspace/out/input_seed.elf"
    },
    {
      "gen": "g1",
      "gen_index": 1,
      "md5": "3c0ee59c8916cc8620d3beb7c98b865e",
      "sha256": "e671e30fb90f2bc53fa6b181fb349cee0dafed13013d6f65715a7a4e881ac3bf",
      "path": "/workspace/out/g1.elf"
    },
    {
      "gen": "g2",
      "gen_index": 2,
      "md5": "3c0ee59c8916cc8620d3beb7c98b865e",
      "sha256": "e671e30fb90f2bc53fa6b181fb349cee0dafed13013d6f65715a7a4e881ac3bf",
      "path": "/workspace/out/g2.elf"
    }
  ],
  "fixed_point": {
    "criterion": "md5(g_k) == md5(g_{k+1}) AND sha256(g_k) == sha256(g_{k+1})",
    "k": 1,
    "k_plus_1": 2,
    "gk_label": "g1",
    "gk_plus1_label": "g2",
    "gk_md5": "3c0ee59c8916cc8620d3beb7c98b865e",
    "gk_plus1_md5": "3c0ee59c8916cc8620d3beb7c98b865e",
    "gk_sha256": "e671e30fb90f2bc53fa6b181fb349cee0dafed13013d6f65715a7a4e881ac3bf",
    "gk_plus1_sha256": "e671e30fb90f2bc53fa6b181fb349cee0dafed13013d6f65715a7a4e881ac3bf",
    "md5_equal": true,
    "sha256_equal": true,
    "verified": true,
    "eyeball_md5": "3c0ee59c8916cc8620d3beb7c98b865e\n3c0ee59c8916cc8620d3beb7c98b865e",
    "eyeball_sha256": "e671e30fb90f2bc53fa6b181fb349cee0dafed13013d6f65715a7a4e881ac3bf\ne671e30fb90f2bc53fa6b181fb349cee0dafed13013d6f65715a7a4e881ac3bf"
  },
  "output_seed": {
    "path": "/workspace/bin/souc-lean-single-x86_64",
    "sha256": "e671e30fb90f2bc53fa6b181fb349cee0dafed13013d6f65715a7a4e881ac3bf",
    "md5": "3c0ee59c8916cc8620d3beb7c98b865e",
    "bytes": 11200547
  },
  "environment": {
    "placement": "local-locked",
    "hostname": "cursor",
    "slurm_partition": "cpu-ops",
    "slurm_time": "00:45:00",
    "slurm_job_id": "",
    "slurm_nodelist": ""
  },
  "checks": {
    "canonical_compiler_gate": "skip",
    "verify_lean_seed": "skip"
  },
  "limits": {
    "provenance_note": "This receipt proves the installed ELF is a self-reproducing fixed point of the recorded source bytes (g_k == g_{k+1}, self-repro). It does NOT by itself prove the ELF was *derived from* that source rather than substituted from another generation that happens to self-reproduce the same source. canonical_compiler_gate.sh checks md5(committed)==md5(self-compile) \u2014 stability, not provenance. Provenance (ELF came FROM this source via this chain) is what the generation table + input_seed hashes are for; a future gate should require a SeedReceipt, not only the self-repro equality."
  }
}
