{
  "schema": "sounio.SeedReceipt",
  "schema_version": 1,
  "receipt_utc": "2026-10-12T23:15:18Z",
  "git_commit": "00173811078d73956e246510ee21a9a59091c31c",
  "git_branch": "fix/module-local-name-resolution",
  "source": {
    "path": "/home/claude/wt/2773/self-hosted/compiler/lean_single.sio",
    "sha256": "db48bef95bcc9e7457ff7b0e743523a3f087d8641ecf75459b0866b5ba79a513",
    "md5": "d75874ba185eeb3670370230c86f89c6",
    "bytes": 2424720
  },
  "input_seed": {
    "path": "/home/claude/wt/2773/out/input_seed.elf",
    "sha256": "aa4922e9dc4e5575eaac1ca0aaf28fc3b7e284ab93f6490f3763b1647e8151a5",
    "md5": "d9aa1509f69d465648fb2bb0c6fba2d3",
    "bytes": 11226863,
    "role": "g0_start_of_chain"
  },
  "generations": [
    {
      "gen": "g0",
      "gen_index": 0,
      "md5": "d9aa1509f69d465648fb2bb0c6fba2d3",
      "sha256": "aa4922e9dc4e5575eaac1ca0aaf28fc3b7e284ab93f6490f3763b1647e8151a5",
      "path": "/home/claude/wt/2773/out/input_seed.elf"
    },
    {
      "gen": "g1",
      "gen_index": 1,
      "md5": "c9a30a44010f8b680f13194f2ecadc06",
      "sha256": "cca95d046b7d56a9f883ce57a466d4b147e85eecb213c5698e47d51d49ef7a53",
      "path": "/home/claude/wt/2773/out/g1.elf"
    },
    {
      "gen": "g2",
      "gen_index": 2,
      "md5": "c9a30a44010f8b680f13194f2ecadc06",
      "sha256": "cca95d046b7d56a9f883ce57a466d4b147e85eecb213c5698e47d51d49ef7a53",
      "path": "/home/claude/wt/2773/out/g2.elf"
    }
  ],
  "fixed_point": {
    "criterion": "md5(g_k) == md5(g_{k+1}) AND sha256(g_k) == sha256(g_{k+1})",
    "k": 1,
    "k_plus_1": 2,
    "gk_label": "g1",
    "gk_plus1_label": "g2",
    "gk_md5": "c9a30a44010f8b680f13194f2ecadc06",
    "gk_plus1_md5": "c9a30a44010f8b680f13194f2ecadc06",
    "gk_sha256": "cca95d046b7d56a9f883ce57a466d4b147e85eecb213c5698e47d51d49ef7a53",
    "gk_plus1_sha256": "cca95d046b7d56a9f883ce57a466d4b147e85eecb213c5698e47d51d49ef7a53",
    "md5_equal": true,
    "sha256_equal": true,
    "verified": true,
    "eyeball_md5": "c9a30a44010f8b680f13194f2ecadc06\nc9a30a44010f8b680f13194f2ecadc06",
    "eyeball_sha256": "cca95d046b7d56a9f883ce57a466d4b147e85eecb213c5698e47d51d49ef7a53\ncca95d046b7d56a9f883ce57a466d4b147e85eecb213c5698e47d51d49ef7a53"
  },
  "output_seed": {
    "path": "/home/claude/wt/2773/bin/souc-lean-single-x86_64",
    "sha256": "cca95d046b7d56a9f883ce57a466d4b147e85eecb213c5698e47d51d49ef7a53",
    "md5": "c9a30a44010f8b680f13194f2ecadc06",
    "bytes": 11280550
  },
  "environment": {
    "placement": "local-locked",
    "hostname": "vm",
    "slurm_partition": "cpu-ops",
    "slurm_time": "00:45:00",
    "slurm_job_id": "",
    "slurm_nodelist": ""
  },
  "checks": {
    "canonical_compiler_gate": "skip",
    "verify_lean_seed": "skip"
  },
  "limits": {
    "provenance_note": "This receipt proves the installed ELF is a self-reproducing fixed point of the recorded source bytes (g_k == g_{k+1}, self-repro). It does NOT by itself prove the ELF was *derived from* that source rather than substituted from another generation that happens to self-reproduce the same source. canonical_compiler_gate.sh checks md5(committed)==md5(self-compile) \u2014 stability, not provenance. Provenance (ELF came FROM this source via this chain) is what the generation table + input_seed hashes are for; a future gate should require a SeedReceipt, not only the self-repro equality."
  }
}
